[
  {
    "local_id": "BURGER-LOCAL-001",
    "producto_id": "17ffc760-e9cc-4597-912b-205c5dace36b",
    "nombre": "Hamburguesa Clásica",
    "precio": 15.0,
    "descripcion": "Carne de res, lechuga, tomate, cebolla",
    "categoria": "Hamburguesas",
    "stock": 50,
    "imagen_url": "https://burgercloud.s3.amazonaws.com/productos/hamburguesa-clasica.jpg"
  },
  {
    "local_id": "BURGER-LOCAL-001",
    "producto_id": "c9070748-1ca9-43fc-bf20-22b538fc435d",
    "nombre": "Cheeseburger",
    "precio": 18.0,
    "descripcion": "Hamburguesa clásica con queso cheddar",
    "categoria": "Hamburguesas",
    "stock": 45,
    "imagen_url": "https://burgercloud.s3.amazonaws.com/productos/cheeseburger.jpg"
  },
  {
    "local_id": "BURGER-LOCAL-001",
    "producto_id": "9f93fc39-74d3-4426-8910-38f41df9736a",
    "nombre": "Hamburguesa BBQ",
    "precio": 20.0,
    "descripcion": "Carne, queso, cebolla caramelizada, salsa BBQ",
    "categoria": "Hamburguesas",
    "stock": 40,
    "imagen_url": "https://burgercloud.s3.amazonaws.com/productos/hamburguesa-bbq.jpg"
  },
  {
    "local_id": "BURGER-LOCAL-001",
    "producto_id": "57a03eaf-434f-4eb3-9a2d-bb511cfeb292",
    "nombre": "Burger Deluxe",
    "precio": 25.0,
    "descripcion": "Doble carne, queso, bacon, huevo",
    "categoria": "Hamburguesas",
    "stock": 30,
    "imagen_url": "https://burgercloud.s3.amazonaws.com/productos/burger-deluxe.jpg"
  },
  {
    "local_id": "BURGER-LOCAL-001",
    "producto_id": "c100b6a0-01ba-4f6c-b841-877e92dbf061",
    "nombre": "Mushroom Swiss Burger",
    "precio": 23.0,
    "descripcion": "Carne, champiñones, queso suizo",
    "categoria": "Hamburguesas",
    "stock": 35,
    "imagen_url": "https://burgercloud.s3.amazonaws.com/productos/mushroom-swiss-burger.jpg"
  },
  {
    "local_id": "BURGER-LOCAL-001",
    "producto_id": "fa555abc-a51f-4632-ad8a-b9fb387844c9",
    "nombre": "Spicy Jalapeño Burger",
    "precio": 22.0,
    "descripcion": "Carne, jalapeños, queso pepper jack",
    "categoria": "Hamburguesas",
    "stock": 38,
    "imagen_url": "https://burgercloud.s3.amazonaws.com/productos/spicy-jalapeno-burger.jpg"
  },
  {
    "local_id": "BURGER-LOCAL-001",
    "producto_id": "19b226f8-5822-4f42-aa63-28688518f685",
    "nombre": "Coca Cola 500ml",
    "precio": 5.0,
    "descripcion": "Bebida gasificada",
    "categoria": "Bebidas",
    "stock": 100,
    "imagen_url": "https://burgercloud.s3.amazonaws.com/productos/coca-cola-500ml.jpg"
  },
  {
    "local_id": "BURGER-LOCAL-001",
    "producto_id": "9e874a4e-f8be-4b50-b388-203e3ea945b7",
    "nombre": "Limonada Natural",
    "precio": 6.0,
    "descripcion": "Limonada fresca",
    "categoria": "Bebidas",
    "stock": 80,
    "imagen_url": "https://burgercloud.s3.amazonaws.com/productos/limonada-natural.jpg"
  },
  {
    "local_id": "BURGER-LOCAL-001",
    "producto_id": "37f8a660-96a0-4457-bb67-255d98d1dcc5",
    "nombre": "Agua Mineral",
    "precio": 3.0,
    "descripcion": "Agua embotellada 500ml",
    "categoria": "Bebidas",
    "stock": 120,
    "imagen_url": "https://burgercloud.s3.amazonaws.com/productos/agua-mineral.jpg"
  },
  {
    "local_id": "BURGER-LOCAL-001",
    "producto_id": "4c7c2f8e-e2f3-4f07-8b9e-aa8112afba06",
    "nombre": "Fanta Naranja 500ml",
    "precio": 5.0,
    "descripcion": "Bebida gasificada sabor naranja",
    "categoria": "Bebidas",
    "stock": 90,
    "imagen_url": "https://burgercloud.s3.amazonaws.com/productos/fanta-naranja-500ml.jpg"
  },
  {
    "local_id": "BURGER-LOCAL-001",
    "producto_id": "838d0580-a461-4c12-93ca-2bb07a32bdb3",
    "nombre": "Sprite 500ml",
    "precio": 5.0,
    "descripcion": "Bebida gasificada sabor lima-limón",
    "categoria": "Bebidas",
    "stock": 95,
    "imagen_url": "https://burgercloud.s3.amazonaws.com/productos/sprite-500ml.jpg"
  }
]